{
  "protocol_version": "1.0",
  "worker_id": "home-windows",
  "instance_id": "f4f209d7-d3ef-4b9c-9c98-5fc8b94f7e86",
  "local": {
    "bridge_ready": true,
    "adapter_status": "running",
    "adapter_ready": true,
    "auth_state": "ready",
    "active_requests": 0,
    "last_inference_success_at": "2026-10-04T01:59:45Z"
  },
  "observed_at": "2026-10-04T02:00:00Z"
}
